<?xml version="1.0" encoding="UTF-8"?>
<agenda xmlns:xsi="http://www.w3.org/2001/XMLSchema-instance" 
                  xsi:noNamespaceSchemaLocation="pag_23_unique.xsd">
  <contacto>
    <nome>Iria</nome>
    <telefono>988988988</telefono>
  </contacto>
  <contacto>
    <nome>Xoel</nome>
    <telefono>988988999</telefono>
  </contacto>
  <!-- ejemplar de prueba para no válido -->
  <contacto>
    <nome>Pedro</nome>
    <telefono>988988999</telefono>
  </contacto>
</agenda>
